text,label
"After the year of study, I started straight summer work and even though I like my summer jobs, I feel more stressed than ever.Even in my spare time, I feel like I can't relax, the whole body is in ""tension"" all the time.I find myself constantly tired and irritable.It is anxious that as a student, the only decent holiday is a Christmas holiday, which is still half a year.",0
"I moved apart from my former spouse a month ago.Almost all recent challenges are related to the construction of a new home, a new kind of family life and financial reflection.At the same time, my own home and freedom to make decisions alone have been empowering.I feel like I'm in a good place right now",1
"I've been on vacation, so of course I've spent the best of the year.There is plenty of energy in the summer and on vacation in a completely different way than at other times.It is unfortunate to find that you are rarely alive so rarely.",1
My work is underway because there have been a lot of tragic and dramatic issues in my private life and I have fatigue physical health issues that have only begun to be treated.I would also like to have a job and better salary that corresponds to my education.Current work does not match this.,0
"Quite well.Holiday study has helped me to cope and my current job does not follow home, which is 1.",1
"On a general level badly. I am a multi -ill and problematic person. However, I may be rehabilitating back to study and working partly from partially weaker thanks to some of the caring social systems, partly. I have severe physical pain and limitations and many mental challenges that interact effectively with each other and easily cause a vicious circle that requires (and has demanded) and my own activity, but definitely also the help of professionals. My biggest challenge is that my mental and physical well -being is by no means my desire to ponder, make and influence for a better world. I am too impatient in the (also) relationship that has led to recurring overrun and the subsequent collapse. On the other hand, some kind of drop -off for years has been a great drug for critical thinking in general, because as we interact with other people, our thinking is strongly convergent. So if these reflections happen to sound like readers of your readers, it is only because I have spent a lot of time alone and guided by my own interests, so that the convergence of the opinion climate cannot happen on the same scale. For me, life is basically a bit of a bit of existential suffering, according to Buddhist and other oriental doctrines, but also impossibly interesting, which is one of the few reasons (though an important one) that still causes me to hold on to the wire.",0
"I've been mostly happy because I'm on a summer vacation and feel free.The ongoing Pride Week, which is now in progress, has brought me joy.My only concern is constantly worrying news from the world (mainly about climate change and wars), a bit of my spouse's mental nausea.",1
"I've been doing very well.I am happy and relaxed and look forward to future challenges and, for example, changes in the fall.",1
"Quite well.Some great, special experiences, lots of warmth and love, but also uncertainty about one's own place in society and the anxiety it causes.",1
"As bad as for several years.I have less than a week after years of employment.Instead, subordinates are at a steady rate weekly.I flex my own free, that even someone is there.It's stupid to ask a couple of funny weeks.This has been shit for a long time.",0
Has fucking my own field I am studying because it doesn't interest me and I can't motivate myself to do anything for it and perform all the bar and stop half of the courses or get abandoned.Living My Best Life,0
The holiday started and there are challenges to go to holiday mode and switch 24/7 with children when not in PVKOD,0
"I have done well at work and it is fun anyway.So does my children.In my spare time, the lack of relationships and sex life is annoying.The everyday life of seeing friends has also changed during the corona and many are more distant today.",1
"I have slept badly (usually less than 6h at night), done too much work and too little things I like.Work is suppressed by all the well -being and I have not been able to move or eat or have been well eaten at all.So I could have been pretty bad.",0
"Pretty bad, I feel anxious and depressed.I hate myself and believe that I have nothing.",0
"I've been doing well since I got rid of the flu.Mentally I have been doing very well.Over the last two weeks, I have had time to rest quite well, which has had a 1 effect on the mood.",1
"Currently, I have more employers and there are new jobs that make me nervous.I have participated in the entrance examinations and waiting for results are nervous.There will be 1 things in the future, but right now it is stressful.",0
"There was fatigue and load.On the other hand, the feeling is quite calm.There is interest in things.Helle has made you feel a little awkward.",1
"I feel exhaustion because my workload is higher, what I feel can.In my opinion, my social life and my leisure activities have been too little.",0
"The previous two weeks have gone to work, on Midsummer and on vacation, with more 1 events (being with friends and family) than nasty (job drama and work).On the other hand, I am a lot of anxiety about my brother's state of health, and this is the first time he is being cut.I am easily anxious if someone in my family go bad and create exaggerated horror scenarios in my mind.However, it has been fun with friends, it has felt like I can sometimes be quite social and relatively normal.All in all, I have been doing well or reasonably, but there have been some nicer moments, when for a moment the troubles have been forgotten, as well as the more sad times when the thought goes to the worse direction.",1
I've been doing very well.,1
"Over the last two weeks, I have been frustrated with the potential for healing of my prolonged depression diagnosis.My therapist is on vacation right now, so I don't get my questions or listeners at the moment.On the other hand, I have been able to communicate well in my relationship and have led to 1 things that have been delighted for the last couple of days.",0
"I have recovered well during my stay and have a lot of pleasant experiences.After returning from vacation to work, I have been relaxed and 1.Everyday life has been relaxed and the relationship has been loving and warm.",1
"Working between professions, difficult patients and rude colleagues, but also successful experiences and 1 encounters.There has been quite a lot of spending in my spare time, which is both a good thing and a bad time (recovery time).Helle has made it powerless.As a whole, moderate well -being, setbacks on its own scale were quite small.",1
"For the last two weeks I've been very happy and happy.At work, I have been responsible for challenging but interesting things.Although the situation may have been stressful at the time of this, I still feel that it was suitable for my skill level.I also got an invitation to participate in a sports project that I am both tense and excited.The weather has been great and I have been able to enjoy them with friends, which has helped to relax.",1
"The condition has fluctuated a bit because I have been ill and my work has still not progressed as expected, so I feel the pressure to get it progressing and the funding is running out.It causes anxiety, but the time spent with loved ones makes it easier.And brings a balance to life.",0
"I have done quite well because the spring pressure has slightly eased and I have been able to do summer things alongside work.A relationship is doing well, so it gives you strength to the rest of your life.",1
"Over the last two weeks, I have had an exceptionally much going on in my daily life.In order to be social on weekends at the same time as I achieve my goals (go to the gym 3 times a week, stretch, move outdoors and play trumpet) I usually work on weekdays, after which I go to the gym and do the same before going to bed.I haven't really had time to stop and relax properly.Although social appointments have been nice, they also feel like work when they have not had time to relax and jump straight to the next week.However, I am proud of myself because I know I couldn't have done more than I have done.",1
I've been doing really well!I spend my time on things that are important to me,1
It has been difficult for me to get over the divorce that happened months ago.My former partner suddenly stopped communicating and I'm really confused because I thought we had a good moment.,0
"I have depression and fatigue.Recently, everyday chores like getting out of bed and eating have been overwhelmingly difficult.Fatigue is present every day.Annoying, frustrating and annoying when I can't do things.The most 1 moments have been when I have been able to do something small, like paying bills, going to the store or cleaning up a little.Also time spent with family and friends will cheer up.",0
"I've been doing well because I have had a lot of nice things to do and friends around.Challenges have come, for example, in nightlife, where I feel harassment.",1
"Instead, I have done yard work.Full impossibility becomes oriented as school work as the kids spin around and the mother of my children does not understand much about the practical realities.The nerve is tight all the time.Fortunately, the holiday begins so you can get a graduation.",0
I've been doing very well.I have survived the challenges and enjoyed the mood when I have survived the challenging issue.,1
"I'm returning from a summer vacation to studying.Also, I'm starting short therapy.I feel rested and hopeful, but also a bit tense in the face of new challenges.I feel ready to return to everyday life, even though my resources in the spring were going to end.",1
"The work sheet has been calm and maybe even a little boring.Leisure, on the other hand, has included great experiences and encounters, I have stopped many times to feel how nice it is.",1
"I was in Korona, that is, I was abnormal.",0
"Physically better all the time, because I still wish for a month ago from the corona.However, I have been quite tired and stressed and I am not going well.I have had difficulty concentration and some tasks are distressing.I currently have too little free time because there is so much work.However, I have tried to see friends regularly and do some nice things, and horse hobby has also helped.Fortunately, for relationships, everything is fine.",0
There have been social challenges because of my impulsive behavior.I have been worried about people and my own activities and also the lack of action.I have been able to vary in different ways depending on the situation and people.,0
"I'm on annual leave and I'm doing well.The challenge is to find out about the meetings and the running of everyday life with the immediate family, as well as the tasks of their own hobbies.Everyone is self -selected and desired.I no longer do anything in my time but I really don't want to.So much I have learned so far ??",1
"Mentally well.I got work gigs for the summer, and in the fall, constantly studying in a new place will make me a happy waiting mood.Now, on vacation, I have been able to relax and do the things I enjoy: spend time with my partner and read books.There have been challenges physically and mentally.My own weight of the corona has begun to depress and distress.Now I'm about to catch myself in the neck.Obesity has mainly aroused depression, but also despair and sadness.",1
Sharing life with people has done that.It is quite a pleasure.,1
"I've been very tired.On work days, there is no energy for anything else, such as sports I would like to do or cook.However, on holidays, I have enjoyed life after spending time with friends and sleeping for a long time without working stress.All in all, I find myself longing for a vacation, but summer goes to work and then continues my studies.",0
"I have been on vacation and was better than if this survey had been done before in the last couple of years. There have been hardly any challenges on vacation, except trying to keep the sleep pattern smart and then learn how to use contact lenses as a new thing. Learning the lens loaded in the spring, but now it was a success and happy feeling enough to recover from the body stress. I have also seen friends more often for a long time, with fewer opportunities during pandemic. It has become a communal fluffy feeling, it feels like a Caberical caring and happiness. I've been happy with the new home and cultivation box. Sometimes it has been a bit annoying to see the travel pictures of others in somewhere that there is no seam now. But the boyfriend has been romantically happy and for the rest of the week we go to the island, which is something I dream of in the winter, so I have been juicing on that dream of dreaming and happy. I have supported my friends if they want to break their mind and feel good to be better than stressful to make it possible to be more supportive for others.",1
"I may have been pretty bad, I have had a lot of stress and setbacks about my studies.These also cause uncertainty about the future.At the same time, I have to work for work pressure even though I am on annual leave.I have found myself very annoyed, sad and very crying.It often feels like I do not recognize myself.In the past I was really 1 and happy now I feel like being fragile and sad",0
"In my spare time in my personal life, I have experienced inadequacy as a talker in the roles: a friend, a boyfriend, a child and a colleague.Speech communication tangles, no intoxicants are in use.The challenges have been the observation of the thunderstorms, including violence videos, lack of sex, loneliness, anxiety.1 experiences of emotional life with a partner, exercise, outdoor activities, entertainment programs.",0
"Tired, I am inexperienced in challenging work and the supervisor gives more responsibility instead of support.I'm frustrated, tired, but also amused about the situation.",0
Very well,1
"The challenges of recent weeks have been more about home front, my husband and my relationship.We have been a bit like a crossroads after more than 25 years of cohabitation and now decided to continue the same path.However, the decision is not easy and it has burdened my summer vacation.",0
"I find myself more irritable again and when I wake up in the morning, the first feeling is a fucking.I know it is because this summer I have to do a full-time week instead of part-time.And more evening shifts, so there is no time for work and sleep a day.I have been to the gym in the evenings because I can't do it by the way, but then it affects the quality of the night's sleep, but it is worth it anyway.",0
"Sometimes I experience anxiety (head and breast squeezing) from my studies.My third year at the university has ended and I still have courses.I feel bad about this because the planned bachelor's stage is three years.I have a mild dyslexia and sometimes I feel that my concentration is getting worse.One teacher has advised and explained that stretching of studies is quite normal.Sometimes I think everything is fine and I do not value myself based on credits.Often, however, I feel that I have failed and I am very afraid of future studies.However, talking to the closest ones makes it easier to dismantle the mind -breaking thoughts.Otherwise, they will swell insurmountable.I often wonder how grateful I am of my closest.",0
"1 things in relationships, 0 in their own inaccessibility and jerking",0
"I've been doing just fine.Because of the summer jobs, the rhythm of everyday life has changed slightly, but in the fall it is nice to go back to studies.",1
"Tired, exhausted but happy.",0
"The last two weeks include a relatively large change of life, which, however, has been known, 1 and expected.The change has brought additional stress, but since close relationships have worked and I have been treated even in the hurry, I feel that, except for individual moments, I have also done very well (meaning that my mood has remained optimistic and calm despite the back packages).",1
"Slight work -based performance pressures on schedule and demanding tasks, but in a way I am quite relaxed with them.I have survived the tasks well and have slightly exceeded my expectations.I have also found that I have a knowledge, which has previously been a little uncertain about the adequacy.It became a nice feeling.",1
"I've been doing really well in recent days. I was my whole short holiday, that is, last week, to my annoyance in pneumonia, but I still got the spiritual rest I needed, and now in July, when the office has no need for my work and all courses have been completed, I finally have time to focus on writing my diploma work. It feels nice that you don't have to stretch to two or three places, but you can focus on one thing without having the idea of ??what else to do in the background. Although I have set a really tight schedule for myself, which was further tightened with two weeks of illness, but stress has not yet hit, and I feel that I work best under pressure. The challenge is that I do not have ADHD medication, even if I benefit especially in writing (queues at FSHS were 4 months old). However, it has not had a significant impact on my mood because I am with you and my challenges. I have also had more time out for outdoor activities and it has calmed my restless mind. One of the most important problems that have been overlooking for months is the life situation of my spouse. His studies have not progressed, he does not receive study grants (the months of support ended due to a previous interrupted degree), he has not been applied for, and has not applied for help, his money is out and he does not receive livelihoods because of Kela (but not law) I should support him because we live together. This has caused me a lot of stress, and also guilt because I have not been able to support him in the right way. Yesterday, however, he sent his first job application and made me feel really relieved and satisfied. However, there was the fear that I did not maintain the level of my colleagues in the standard of living because I have chosen a spouse who can barely support himself. In addition, the situation arouses anger about his multi -problem parents, primary school teachers and society as a whole, while current politics, on the one hand, pursues together due to high cost of living, and, on the other hand, punishes the couple's worse acting party in the form of lower support.",1
"Stress, in a responsible job that I do not feel qualified but I guess it all the time is learned",0
I have encountered a few setbacks in a bigger project that has been in the mood.,0
"Tired, stressed, in the background of knowing that I should do a good thesis but I just can't handle.Work situation confusing, stress too.I sleep badly, I don't fall asleep without medication.The heat makes you feel crazy.A happy child and swimming pool is good, the feel of the cool water on the skin rinses out worries.Coffee and dismantling with the brother's wife is also good.It empties the head and stops at the point of thought.The journey to Estonia was lovely-- lots of beautiful scenery, the sea shore and good food, but it was strenuous.The heel is sore, it takes joy from everything that involves moving.I try to cover it from others because it would need rest to heal and there is no time right now.I always think about others and their needs.I can't let go.The future scares.",0
"I've been on vacation in Italy so I've experienced new nice things, some physical strain and stress caused by travel.Mainly I have been happy and happy.",1
"I have done quite well, although I have recently focused on the themes of eco -disaster and fossil capitalism in my studies just last two weeks and have been more and more convinced of the perikato.Although I have been doing these studies for several years, so this is not a new thing, but I am studying more, so I think more.Contrary to what could be inferred from this, I have not been depressed in any way, etc., because I have already dealt with this over the past few years.But the constant reading of heavy scientific research is, of course, the most heavily possible subject to a long time for a long time.Conclusion: I could have been better than these Specs you might think you can.",1
Relaxed because I've been on vacation almost every day.,1
"The last two weeks have been special because I have experienced a bunch of challenges in one week and another more relaxed life.The week before I got bad news about an important person's state of health, which was really stressful and distressing.At the same time, there was a really challenging and difficult course where I did not receive the support I needed and were quite alone with the challenges, which further increased stress levels.Fortunately, however, the course is now in the package, which significantly relieved stress levels and facilitated the state.",1
"stressed, tired of the little one, I didn't get just about anything",0
It is time to get the challenges to work.The emotional state is anxious and uncertain due to a health problem.,0
"I have had to step outside my comfort zone during my studies and work.This has caused stress and made me feel anxiety and anxiety.But for the most part I have done well and I have had time for myself and my friends, which has helped keep stress under control.",0
"I have been doing well because I start my doctoral dissertation studies I've been dreaming of for a long time.Summer and sun also have a 1 effect on my mood.However, challenges are my financial situation because I have no funding yet and I get a really bad salary for my current job.The world political situation and climate change are also worrying.",1
"Stressed, irritated, tired, crying sensitive",0
I have been tired of my job and wondered how and when to resign.,0
"In the last two weeks I have been able to vary.I've been both happy, happy and enthusiastic and depressed, restless, skeptical and tired.I have not got the right or continued things that seem too challenging and that are urgent and where the probabilities of success seem to be reduced over time.So I feel stuck.",0
"Pretty bad.Has tried to holiday without being able to calm down, relax and refresh properly.Lost time on the wrong things.",0
"I have been on vacation and have done things I like, that is, very well, but workplace tensions have even plagued every day",1
