text,label
"Really bad.I burned out and I have not recovered yet because I have never done the recovery process (= vacation).Cycling with a really bad thing.The challenge is the industry I have chosen, plus people.In the bad era of the moment, not terribly 1 events when you are challenging to have normal things.",0
"I have been able to vary in two weeks, the emotional states have changed from cheerful to sad, and I have been quite tired because of my work and my life.I resigned from a long relationship a month ago, and it has produced both sleep problems as well as general depression and anxiety.On the other hand, at the same time, on my work front, I have gained new challenges and new winds, and spent a lot of time with my loved ones.This has had a 1 impact on one's own well -being and also supported during a difficult time.",0
"I've been restful and calm.Occasionally, insomnia has occasionally hampered rest.I wake up early in the morning and I'm tired and tired in the morning hours.Nightmares have often been related to my profession.",0
"Quite varied due to the challenges of my personal life.However, the situation has been compensated for the beginning of the ""holiday"", that is, my studies ended and I do part-time work alone.",1
"Four days ago I returned my bachelor's thesis and it was very stressful and exciting.Since then, I've got a little relaxation and enjoyed the summer.A week ago, I was watching at night, taking care of the thesis.",1
I probably have a job for five people and it is difficult to refuse them because I have to grow CV and publish as much articles as possible because I am at the university and have to apply for funding all the time,0
It is difficult to believe that working life would never have anything 1 to offer.,0
"In general, I have been doing well and been happy.Much has happened in two weeks.I've seen a lot of friends and relatives, been at the party and planned for the future.I have done some overtime because I have missed hours from previous weeks.I may not have slept enough, but I know that since next week there will be more time.I graduated with a master's degree and agreed on work patterns.I have been proud of my studies and for daring to be myself.On the other hand, I have not been the most satisfied with my current work, mainly because of its one -sidedness and low salary.But this is not a big problem because the employment relationship is short -term.",1
"I've been over to overtime because I sometimes take a little too much work for myself when many things are interested.That's why I have probably suffered from difficulty falling asleep.My work is physically and sometimes mentally heavy and after work I have been tired.However, there are nice things happening in your spare time - band hobbies and friends keep your mind good.",0
"There is a hurry at work, but I try my best to not get stressed anyway.I am more worried about my somatic health.I am happy about my relationships and friends.",1
"Lots of important events (daughter's yo and entrance examinations, as well as the boy's graduation from elementary school and access to high school) and decisions (selling a summer cottage and buying an apartment) + own artistic work.Excitement, stress, feelings of happiness and gratitude.Concerns about their own well -being and mental well -being and the economy.",1
The work has been distressed.,0
"I have slept and have been rested in varying degrees.This has influenced my coping during the day at work and to get things done.I have worked a lot in the evenings and on weekends in my spare time to get my job done.However, this has been my choice.I want to do the job well and show my necessity.",1
Summer vacation so more free time and a nice program anyway.Life goes well.,1
I can't get rid of work even though I'm already on vacation.They spin in my head and in my dreams.There are also things in the messages that require a reaction.I am tired in a way I have never been before.,0
"""Summer vacation"" has brought a little relaxation to everyday life, so I feel better than during the school year.However, I still have less than a number of credits from the school year, so I try to force the dice in addition to work.Fortunately, I am in a supervision job that really has no job if everything goes well.",1
"Dreams were low due to an event of one week, where I was volunteering.Sleep deprivation immediately affects coping, and everything seems difficult.Communality was a stunning experience, and after a couple of rest days (12-14 hours), it is quite normal again.I heard that I had access to a field that is my passion, and I'm so excited.At the same time, it's excited to go to the school bench after a break of more than 10 years.There is a challenge in a relationship because of another illness, but we go day by day.All in all a good feeling, and feeling really good about the circumstances.I could be quite paralyzed.",0
I have been well.The work is meaningful and I can learn/improve my special expertise.,1
"I've been really anxious, depressed and tired.I find it difficult to focus on work or really anything.My insomnia is pretty much chronic: I never really sleep more than five hours a night and wake up many times in the middle of the night.",0
"I have been well.There are big solutions at work, but the top management has given them enough time and resources to do them.At the same time, I'm tense and excited.",1
"Occasionally, past events are disturbing me, even though they have been 8-10 years old.Poor self -esteem and experiencing loneliness.On the other hand, at home I can relax and enjoy music, online surfing and good food.Summer refreshes mood.",0
"Poor, because in a day it is not enough to do the work well, take care of the home (where the spouse just messes) and hobbies.The state of NATO membership in Finland is also constantly distressing and I am afraid of starting the war.I have been very stressed and tense and I consider the difference between the spouse and resignation every day, and move to a small cabin alone somewhere far from other people and the evil of the world.",0
"In teleworking, it is harder to remain scarp compared to working in the workplace.",0
I have been well.I have experienced work and studying stress at the same time and the future is distressing.I do not know what are important decisions for the future and I am afraid to make and choose wrong.,0
"Very.Current work gives you the opportunity to develop yourself, autonomy is great and the work is rewarding.There is no need to work all the way and the hours of work are human.",1
"For the past two weeks, I have been more tired than usual, but otherwise well -off.",0
"At the beginning of last week, I was stressed about time and livelihood, but the last few days have provided me with solutions and happy opportunities.",1
I've been quite stressed because of the new work and it has also caused a lot of fatigue,0
There is too much work at work and the work is cognitively and physically stressful.There are constantly in the work community and no common means of protecting them from them when you are the only one who uses the respirator.There is no occupational safety and health.People's irresponsibility burdens.,0
I have been able to vary.,1
"I've been doing well because I've been on vacation.Otherwise, I have a confidence in my life, because completing a higher education degree is only three courses and a graduation.After that, I start the company.",1
"On vacation, I can be excellent, I can be present for my children, eat healthy, sleep enough, I can focus on goal -oriented sports.Life feels worth living.",1
"Finishing and refunding the thesis has been exhausting in addition to work.I have been tired and anxious and falling asleep in the evenings, while in the mornings, waking up is sometimes insurmountable.For this reason, I have gone late to work and worked for a long time.1 success has been a personal success in leisure time, which is happy to surprise other people.",0
"Again, I have been disappointed with my doctoral thesis counselors and their communication ability, their desire to help me with the end of the dissertation process, their laziness to read messages and cultural differences. I feel physical feeling when I should do a doctoral dissertation, I need beta blockers, and my instructor wants to prolong the process and intend to sit on the texts for 7 weeks. I am delighted with my kids, but I am in pain and I can't be terribly constructive when they want to buy expensive pens and filling cartridges for over 30 euros after the promised hoplop trip, and yesterday they wanted some toys and the wish list already has expensive pens. I am disgusted with how little my spouse is interested in me and my news, and almost horrified at how a different picture he gives himself when he is the parent of the Parents' Association and what he is at home. I have experienced that I was left alone to survive everything without giving me resources and tools for it. I have often been hungry, and I have been disappointed with myself when I have not remembered to plan when I go to the grocery store and what we have to eat.",0
"I have been doing well, and there are a lot of wonderful things to come to me with me to look forward to;Best friend's birthday party, together with friends and among others.A migration with a boyfriend.From time to time, I have experienced low work motivation in the last couple of weeks, as my work is very time -time and there are few employees.Fortunately, I have been compensated for work motivation feelings by paying more attention to other aspects of life, and at the moment I get a lot of joy and strength from my relationships.",1
"Over the last two weeks, I have been doing well and has been accompanied by many 1 events and 1, exceeded challenges.During the winter and spring, I went through a very challenging phase with my supervisors and I thought I was treated unfairly and inappropriately, which still feels, even though fortunately the situation has improved between us after the discussion.At the moment, however, I am mainly happy with the situation, even though I do not easily feel that I can turn to my supervisors in difficult issues.Fortunately, there are other people in the workplace who have supported.",1
Better than before.The total load on work and studies has decreased.It is easy to focus solely on work and not by balance between studies and work.,1
"It's been a really busy week at my work and I've worked twice as much as normal.It has also just moved home by an impossibly active puppy that eats everything and requires a lot of attention.So there has been enough to do, but now it starts to make it easier.",0
"Teacher deputy, but teaching a full hourly employment contract signed from August.Ecstatic.",1
"Depressed, anxious, stressed.The school is not progressing, the work is numb and does not correspond to training in any way.Hrsnly maintained when no one is interested in communication",0
"Relatively well.The progress and clarification of things have brought new vigor and motivation to my work.I also managed to clean my home with thoroughly what motivates and clarifies my head.Yes, I have been very tired as the long graduation contract closes the end.I easily drop the goods and thinking has slowed down.My physical health has been quite smooth and I am not going to have a bad season right now.This also helps to cope with a lot of time, as weak physical health takes everyday life.",1
"Inu has had a small flu so part of the time has gone to recover.Now it is good and vigorous.Even before Midsummer, I do things that I couldn't do last week due to illness.",1
"Two weeks of illness, so coping with everyday card.I will be 1 about the start of the holiday.",1
"Many different emotional states.Starting in a new job has been consuming, especially when it is a bit sore at the same time.I'm 1 and I believe there is a good balance for everything.A week's work tube after a week abroad feels tough.",1
"Exhausted and auxiliary.Continuous physical fatigue and depressed feeling of despair are constantly present.I can't get things done.I forget more about my duties or avoid them, consciously exacerbating my situation.I try to find out for a day for an hour at a time from everyday life, and the day or workload of the week does not matter to fighting.Crying and feeling disappointed even though everything is still well -mental nausea and constant anxiety.",0
"The well -being has gone to the roller coaster due to the events in my immediate circle, otherwise the overall appearance has been prosperous.",1
"I've been critically pondering about my down choice for a long time.However, I have not dared to make a decision in one direction or another.This indecision and ""phasing"" will burden my mind.By the way, outside of working life, in my life, everything very well, although the career choice of a career overshadowed every day.",0
"I succeeded in the job, even though it seemed difficult (I knew I could, but it felt like a hassle).On the other hand, I do part -time work, so the job search is currently constant.The challenge is to motivate myself to apply for a job again after the last disappointment.The challenge of personal life is two losses of relationships during the spring and summer",1
"Evenly well. I have been a bit stressful about the rhythm of work, as I will soon do two jobs at the same time, one of which is independent and the other is done by the store, and I should write the final thesis. However, I have achieved peace for these things and I believe I will survive well enough. I have met a lot of new people at my friend's wedding and my partner's relatives who have been a little tense in advance, but the situations have gone well and have been a good and successful mind for a longer period of time. In addition, we went on a hiking trip for a few days, which, of course, was physically tough and nervous, but mostly promoted break -up and relaxation. In addition, various nature findings were delighted with the trip. I hate the heat and after studying the weather map of the coming week I felt a bit of anxiety. However, the general profile is relaxed and waiting. Many times in the summer, the pressure is that you should be fully in life, outdoor activities and take all the joy out of the summer, but now you are accepting. Being in the woods and spending has also been released from the world's situation, such as war, other nasty events and climate change, which often distress in everyday life.",1
"I've been doing fairly well.Sleeping has not always been successful, which has influenced coping and mood in internship.My performance in certain social situations has been bothered afterwards, but I have gone beyond them quite quickly.The difficulties thrown in front of me have not seemed completely overwhelming, and I have also gained success after coping with quite a bit of a situation I had been very afraid in advance.",1
"I have been a little stressed and longed for my time and holidays.However, I have also been really excited, inspired and experienced nice things.",1
"I have done well challenges: where to motivate the study course that doesn't interest you, where the drive to work now is much quieter than normal.Inadequate when things have not gone perfectly.1: Good collaboration with clients and colleagues who creates feelings of trust and qualifications, both that my job has value",1
There have been some challenges in my personal life that revolve around in my mind.Studying issues are also stressful.I may have slept a little too much and moved too little.,0
"My well -being has been very variable.Sometimes I think life is wonderful and everything is fine, but the same day I may still think that everything is bad and nothing can help with it.The situation is familiar and so I feel, but I don't remember experiencing this during the summer.",0
"Stress, distress, fuck.I'm sleeping badly.",0
"-I have been thinking for a long time about death and life every day -I was a couple of months ago an interesting person with whom I have spent time -the person is badly depressed and says he wants to love me, but generally does not know much of the feelings of happiness, and for example, he cried for the first time in my yearsfor me.Apparently it was a good thing -in the last two weeks this person has fulfilled my thoughts by himself and made me doubt myself that I can't believe he wants to spend time with me",0
Too hot -> exports energy action.Studies weigh on -> nothing can do -> distress.,0
"In general, I have been able to do quite well, but I have had to constantly take care of coping and balance with stress and pressure (which I put myself).So there is stress and concern, but they have stayed in control (even if I would rather be without)",0
I've been tired but still motivated to work.Relationship stories have been a bit pressed.,1
"I have been quite nervous, worried, impatient and unreasonable, which has certainly been influenced by, for example.My pet's illness and the delay of the news I expect.",0
"Exceptionally well, due to the phase of the work (final stage of one entity) and the good news related to (another) work, on the other hand, the subject of a loved one.",1
"Generally speaking, I have done well and get strength from small, everyday things.Occasionally, the amount of concerns and challenges exceeds tolerance, and I am sensitive, overreacting and tight.Usually I get over these situations well, but lately I have had the feeling that I would like to talk about my well -being with a professional.I have not received the desired help from the work psychologist.",1
"Difficulty in falling asleep, no power to do anything on the free, too much agreed stuff, also nice stuff is distressing when there are too many agreed expenses.",0
"The state of mind has been elevated.However, during the summer vacation, I have been able to take a little calmly.There has been no real restful space.Heat is difficult and takes energy",1
"I have just changed jobs and started doing sports and started to be able to be able to be great.There are communication challenges in my work, as many misunderstands my question.This is definitely normal, but I'm bored up during Korona!",1
"I've been doing well over the last two weeks.I've been quite busy, but I've also done a lot and all kinds of nice things I have been doing.Sometimes homework has been challenging because other things have become so tired.Mostly has been a great, satisfied and happy feeling.Bright and long days and warm air have maintained a 1 mood.I have seen friends, relatives and fun other, which has made a good mood.Studying, world situation (war in Ukraine), economic situation (own and general), and the health of loved ones have sometimes caused stress and concern.",1
I experienced joy and malewear when the course I proposed was approved for the curriculum and was interested in it,1
"Mostly well.Home and leisure time have gone well.There have been several challenging situations at work that have influenced my well -being, but not greatly.",1
A new job to take on bigger tasks for the first time.Gone well.New life when I've moved to a new city where I learned new things all the time.I enjoy and throw myself.,1
"The work week was heavy, but when I got on vacation, stress was easier.However, the upcoming foreign trip and the associated adjustment caused additional stress, but it is a nice trip I decided not to stress unnecessary.",0
"I've been on a summer vacation for the last few weeks since a very stressful spring.Lepo has done good, and it is nice to concentrate sometimes on your own projects without worrying about whether they will be completed on a specified schedule.",1
"Pretty badness, [Content warning suicide].The guy wants to die and I have tried to keep it alive.By the way, it's okay, except for school stuff, I did too much, the heat kills the rest of the motivation and starts with stress.So a lot of all serious here now.",0
I've been on vacation and mostly just slept out of exhaustion.,0
"I'm tired, exhausted, stressed.The reasons are both in the personal life and at work.I recently started at work and I am unsure of what is really expected of me, whether to trust that I do meaningful things independently.The work community has long been missing, there are only formally, I do telework, I find myself very lonely both professionally and otherwise.There are few friends and resources often have little to communicate.All kinds of worrying takes energy.",0
I have been doing well and got to learn new things,1
"Constantly tired.There have been too much work lately, and since I only work 3 days/week because of my studies, the pressure to work overtime is higher than usual (because there are more days a week than 3, so it's hard to appeal to not, especially in the summer).Every week I think ""this week still, and then easier"".In reality, you never make it easier.Or at least that joy won't last long.",0
Work and free time hurrying a lot,0
"For the last two weeks I've been doing just fine.Spring has been pretty tough, but the worst is behind, now we still have to work on the projects to the model that you can stay on a summer vacation.Currently, I am also a substitute for my supervisor, which brings extra pressure, but also satisfaction that I can help my supervisor to be able to trust me and leave work and take care of the holidays.",1
"The last two weeks have been quite atypical because I have mostly consumed the accumulated balance lessons, and before that I hosted the group's nice, rather familiar foreign guests.The challenges have mainly been the remembrance of events outside that program, and the fact that I cannot express myself in English as well as I would.Meeting of foreign colleagues is only aqui -way and expanding.Also, it was probably the first bigger present meeting outside your organization, and it was nice too.",0
"I haven't really got to study.I fill my day with insignificant activities, instead of seeking things that I really want.I feel the inability to start, and at times I also have difficulty concentration, although I am usually good to concentrate as long as I start.I have been able to sleep badly because I find it uncomfortable to lie in bed alone with my thoughts.I watch videos or something in bed until I fall asleep and it may take.Now two nights I have managed to fall asleep faster, and it feels good, but it has still been difficult during the day to start studying.",0
"I am stressed out of a thesis where there is even more work left than I was originally evaluated.Also, I'm afraid I've done a bad job with it.The fact that I took shifts for the summer with the thesis has been a big burden on coping and there is not enough energy for any sport, leisure activities, seeing friends or relaxing.I experience anxiety as well as my thesis and my financial situation, but I feel that I can't invest enough at the same time.A few friends meetings have been a nice break for a smooth everyday life, and one afternoon on the beach was an exception that has not been like.",0
"Mostly I have been doing well. I've been on a summer vacation that is unlikely to come in the next few years, because I'm about to graduate and when I get to work, you can just dream of such a long summer vacation. On the other hand, a long summer vacation has provided the person with the opportunity to implement hobbies that I have not been able to do during school rush or Korona. On the other hand, I have experienced anxiety that I have not had enough to do on vacation and I have been very bored on individual days. However, the holiday has made it possible to meet old friends with a quick time, which has been nice and rewarding. Despite the holiday, the challenges have been brought to life by a rather recent relationship and combining it with all other expenses. In addition, the partner's mental health issues have been concerned, even though I am not constantly worried. Menstruation of biological women's lives has also caused me to feel sick over the last two weeks. I have overcome the issues of sorrow and anxiety by talking to family, partner and friends. Discussing and dealing with one's own thoughts with others helps a lot of one's own sickness. In addition, planning things and spending brings me peace of mind and makes it easier for me. At least you should enjoy the happy moments in an instant, but remembering them brings back the good. It is definitely that I have enough to do all the time, but it may also be related to stopping to listen to the bird's song or the hum of the wind in the trees.",1
"Pressured by the Amount of Work and BeCause i've Given Responsibilites That Do Not Correspond to Me.HowEver, Recently a third party (funding agency) funded and recognized my work as Worthyt.So i feel validated by external Sources But not by my superiors.",0
"My employment contract was continued for a year just two weeks ago, so right now the mind is calm.I also went to a summer cottage where I have been able to do much more.I could actually have quite a few weeks back.",1
"I've been doing quite well over the last few weeks.Summer vacation has just begun, and it is likely that my employment will continue, which will significantly increase the mood.In the weeks before the holiday, I experienced stress because I was busy and constant at work and the tasks that caused the feeling of being alert.",1
"I have been doing well, even though my future research industry is at stake due to the difficult availability of external funding.",1
